{"schemaVersion":"1.0","traceId":"redacted-phase-2b-task-contract-materialization","algorithm":{"name":"progresstrace-stop-assessor","version":"1.0.0"},"terminationEventId":"event-003","terminationKind":"natural-completion","declarationSource":{"producerType":"adapter","producerName":"reference-adapter-v0","producerVersion":"0","evidenceBasis":"adapter-inference"},"terminationAttested":true,"terminationRank":2,"obligationResults":[{"obligationId":"task-contract-materialization","classification":"progress","evidenceEventIds":["event-001","event-002"],"outcome":"stable-attainment","stableAttainmentRank":1,"overhead":1}],"traceClassification":"progress","stopClassification":"late-termination","safeStopRank":1,"traceOverhead":1}
