{"schemaVersion":"1.0","traceId":"synthetic-multi-event","algorithm":{"name":"progresstrace-stop-assessor","version":"1.0.0"},"terminationEventId":"event-002","terminationKind":"timeout","declarationSource":{"producerType":"harness","producerName":"example-harness","producerVersion":"2.3.0","evidenceBasis":"harness-lifecycle"},"terminationAttested":true,"terminationRank":1,"obligationResults":[{"obligationId":"obl-a","classification":"progress","evidenceEventIds":["event-002"],"outcome":"stable-attainment","stableAttainmentRank":1,"overhead":0},{"obligationId":"obl-b","classification":"stagnation","evidenceEventIds":["event-001"],"outcome":"unmet-target-at-termination","stableAttainmentRank":null,"overhead":null}],"traceClassification":"stagnation","stopClassification":"unmet-target-at-termination-present","safeStopRank":null,"traceOverhead":null}
