{"schemaVersion":"1.0","traceId":"synthetic-multi-event","algorithm":{"name":"progresstrace-stop-assessor","version":"1.0.0"},"terminationEventId":"event-002","terminationKind":"capture-truncated","declarationSource":{"producerType":"adapter","producerName":"example-otel-adapter","producerVersion":"0.9.1","evidenceBasis":"adapter-inference"},"terminationAttested":false,"terminationRank":1,"obligationResults":[{"obligationId":"obl-a","classification":"progress","evidenceEventIds":["event-002"],"outcome":"stable-attainment","stableAttainmentRank":1,"overhead":0}],"traceClassification":"progress","stopClassification":"incomplete-observation","safeStopRank":null,"traceOverhead":null}
