{"schemaVersion":"1.0","traceId":"redacted-phase-2b-codex-build-path-policy-recovery","algorithm":{"name":"progresstrace-stop-assessor","version":"1.0.0"},"terminationEventId":"event-003","terminationKind":"harness-declared-stop","declarationSource":{"producerType":"harness","producerName":"redacted-projected-harness","producerVersion":"0","evidenceBasis":"harness-lifecycle"},"terminationAttested":true,"terminationRank":2,"obligationResults":[{"obligationId":"implementation","classification":"progress","evidenceEventIds":["event-001","event-002"],"outcome":"stable-attainment","stableAttainmentRank":1,"overhead":1},{"obligationId":"path-policy","classification":"regression","evidenceEventIds":["event-001","event-002"],"outcome":"unmet-target-at-termination","stableAttainmentRank":null,"overhead":null}],"traceClassification":"regression","stopClassification":"unmet-target-at-termination-present","safeStopRank":null,"traceOverhead":null}
