{"schemaVersion":"1.0","traceId":"synthetic-non-contiguous","algorithm":{"name":"progresstrace-stop-assessor","version":"1.0.0"},"terminationEventId":"nc-evt-3","terminationKind":"agent-self-reported-stop","declarationSource":{"producerType":"agent","producerName":"example-agent","producerVersion":"1.0.0","evidenceBasis":"agent-output"},"terminationAttested":true,"terminationRank":3,"obligationResults":[{"obligationId":"obl-a","classification":"progress","evidenceEventIds":["nc-evt-0"],"outcome":"stable-attainment","stableAttainmentRank":0,"overhead":3},{"obligationId":"obl-b","classification":"progress","evidenceEventIds":["nc-evt-2"],"outcome":"stable-attainment","stableAttainmentRank":2,"overhead":1}],"traceClassification":"progress","stopClassification":"late-termination","safeStopRank":2,"traceOverhead":1}
