{"schemaVersion":"1.0","traceId":"synthetic-non-contiguous","algorithm":{"name":"progresstrace-stop-assessor","version":"1.0.0"},"terminationEventId":"nc-evt-3","terminationKind":"harness-declared-stop","declarationSource":{"producerType":"harness","producerName":"example-harness","producerVersion":"2.3.0","evidenceBasis":"harness-lifecycle"},"terminationAttested":true,"terminationRank":3,"obligationResults":[{"obligationId":"obl-a","classification":"regression","evidenceEventIds":["nc-evt-0","nc-evt-1"],"outcome":"unmet-target-at-termination","stableAttainmentRank":null,"overhead":null}],"traceClassification":"regression","stopClassification":"unmet-target-at-termination-present","safeStopRank":null,"traceOverhead":null}
