{"schemaVersion":"1.0","traceId":"synthetic-multi-event","algorithm":{"name":"progresstrace-stop-assessor","version":"1.0.0"},"terminationEventId":"event-002","terminationKind":"unknown","declarationSource":{"producerType":"operator","producerName":"release-operator-role","producerVersion":null,"evidenceBasis":"operator-annotation"},"terminationAttested":false,"terminationRank":1,"obligationResults":[{"obligationId":"obl-a","classification":"progress","evidenceEventIds":["event-002"],"outcome":"stable-attainment","stableAttainmentRank":1,"overhead":0}],"traceClassification":"progress","stopClassification":"incomplete-observation","safeStopRank":null,"traceOverhead":null}
