{"schemaVersion":"1.0","traceId":"synthetic-multi-event","algorithm":{"name":"progresstrace-stop-assessor","version":"1.0.0"},"terminationEventId":"event-002","terminationKind":"crash-or-error","declarationSource":{"producerType":"adapter","producerName":"example-crash-adapter","producerVersion":"1.2.0","evidenceBasis":"adapter-inference"},"terminationAttested":true,"terminationRank":1,"obligationResults":[{"obligationId":"obl-1","classification":"insufficient-evidence","evidenceEventIds":[],"outcome":"unmet-target-at-termination","stableAttainmentRank":null,"overhead":null}],"traceClassification":"insufficient-evidence","stopClassification":"unmet-target-at-termination-present","safeStopRank":null,"traceOverhead":null}
