{"schemaVersion":"1.0","traceId":"redacted-phase-2b-semantic-review-and-integration","algorithm":{"name":"progresstrace-stop-assessor","version":"1.0.0"},"terminationEventId":"event-004","terminationKind":"natural-completion","declarationSource":{"producerType":"adapter","producerName":"reference-adapter-v0","producerVersion":"0","evidenceBasis":"adapter-inference"},"terminationAttested":true,"terminationRank":3,"obligationResults":[{"obligationId":"semantic-review","classification":"progress","evidenceEventIds":["event-001"],"outcome":"stable-attainment","stableAttainmentRank":0,"overhead":3},{"obligationId":"integration","classification":"progress","evidenceEventIds":["event-002"],"outcome":"stable-attainment","stableAttainmentRank":1,"overhead":2},{"obligationId":"hosted-verification","classification":"progress","evidenceEventIds":["event-003"],"outcome":"stable-attainment","stableAttainmentRank":2,"overhead":1}],"traceClassification":"progress","stopClassification":"late-termination","safeStopRank":2,"traceOverhead":1}
